{
  "$schema": "https://json-schema.org/draft/2020-12/schema",
  "$id": "https://github.com/SidCorp-co/archmap/schema/arch.schema.json",
  "title": "archmap manifest",
  "description": "A project's declared architecture. Closed vocabulary: an unknown contract type is an error, never a warning (SPEC.md §2).",
  "type": "object",
  "additionalProperties": false,
  "required": [
    "version"
  ],
  "properties": {
    "version": {
      "const": 1
    },
    "tsConfig": {
      "type": "string",
      "description": "Repo-relative path to a tsconfig whose `compilerOptions.paths` dependency-cruiser should resolve through. Needed in a monorepo whose aliases live per package and whose root carries no config at all: without it every aliased import is unresolvable, and an unresolvable edge is dropped rather than reported, so contracts over that package pass on an empty graph. When absent, a tsconfig.json/jsconfig.json at the root is used if one exists. A declared path that is not a file makes the gate refuse to run."
    },
    "modules": {
      "type": "object",
      "description": "Module name to the globs whose files belong to it. Later declarations win, so a narrow module can carve itself out of a broader one (§6).",
      "additionalProperties": {
        "type": "array",
        "items": {
          "type": "string"
        }
      },
      "propertyNames": {
        "pattern": "^[a-z0-9][a-z0-9-]*$"
      }
    },
    "tests": {
      "type": "object",
      "additionalProperties": false,
      "description": "Test files are a first-class kind, not an exemption list. `relax` removes named contract types for test files only (§6.1).",
      "properties": {
        "globs": {
          "type": "array",
          "items": {
            "type": "string"
          }
        },
        "relax": {
          "type": "array",
          "items": {
            "enum": [
              "layers",
              "forbidden",
              "independence",
              "boundary",
              "fan-out"
            ]
          }
        }
      }
    },
    "generated": {
      "type": "object",
      "additionalProperties": false,
      "description": "Generated code belongs to no module. Edges touching it are dropped rather than attributed (§6).",
      "properties": {
        "globs": {
          "type": "array",
          "items": {
            "type": "string"
          }
        }
      }
    },
    "exclude": {
      "type": "array",
      "description": "Paths outside the graph entirely.",
      "items": {
        "type": "string"
      }
    },
    "size": {
      "type": "object",
      "additionalProperties": false,
      "description": "Thresholds declared once and generated into each language's native linter. archmap does not count lines itself (§5.1).",
      "properties": {
        "max_file_lines": {
          "type": "integer",
          "minimum": 1
        },
        "max_function_lines": {
          "type": "integer",
          "minimum": 1
        },
        "max_files_per_dir": {
          "type": "integer",
          "minimum": 1
        }
      }
    },
    "contracts": {
      "type": "array",
      "items": {
        "$ref": "#/$defs/contract"
      }
    }
  },
  "$defs": {
    "base": {
      "type": "object",
      "required": [
        "id",
        "type"
      ],
      "properties": {
        "id": {
          "type": "string",
          "pattern": "^[a-z0-9][a-z0-9-]*$"
        },
        "status": {
          "enum": [
            "draft",
            "locked"
          ],
          "default": "draft",
          "description": "draft reports, locked blocks. Status is per contract — there is no repo-wide mode (§8)."
        },
        "description": {
          "type": "string",
          "description": "Why this rule exists. Printed with the finding, so it is the remedy's context rather than a comment."
        }
      }
    },
    "contract": {
      "allOf": [
        {
          "$ref": "#/$defs/base"
        }
      ],
      "oneOf": [
        {
          "title": "layers",
          "required": [
            "type",
            "order"
          ],
          "properties": {
            "type": {
              "const": "layers"
            },
            "order": {
              "type": "array",
              "minItems": 2,
              "items": {
                "type": "string"
              },
              "description": "Highest first. A module may depend on any module later in the list, never earlier."
            }
          }
        },
        {
          "title": "forbidden",
          "required": [
            "type",
            "from",
            "to"
          ],
          "properties": {
            "type": {
              "const": "forbidden"
            },
            "from": {
              "type": "string"
            },
            "to": {
              "oneOf": [
                {
                  "type": "string"
                },
                {
                  "type": "array",
                  "items": {
                    "type": "string"
                  },
                  "minItems": 1
                }
              ],
              "description": "Module names, path globs, or the wildcard \"*\" meaning the module may depend on nothing outside itself."
            }
          }
        },
        {
          "title": "independence",
          "required": [
            "type",
            "modules"
          ],
          "properties": {
            "type": {
              "const": "independence"
            },
            "modules": {
              "type": "array",
              "minItems": 2,
              "items": {
                "type": "string"
              },
              "description": "Checked transitively — the common real violation is two features glued through a module neither one names."
            }
          }
        },
        {
          "title": "boundary",
          "required": [
            "type",
            "module",
            "public"
          ],
          "properties": {
            "type": {
              "const": "boundary"
            },
            "module": {
              "type": "string"
            },
            "public": {
              "type": "array",
              "minItems": 1,
              "items": {
                "type": "string"
              },
              "description": "Globs for the module's entry points. Any cross-module edge landing elsewhere is a divergence."
            }
          }
        },
        {
          "title": "fan-out",
          "required": [
            "type",
            "max_modules"
          ],
          "properties": {
            "type": {
              "const": "fan-out"
            },
            "max_modules": {
              "type": "integer",
              "minimum": 1
            },
            "scope": {
              "enum": [
                "file",
                "module"
              ],
              "default": "file"
            }
          }
        },
        {
          "title": "absence",
          "required": [
            "type",
            "from",
            "to"
          ],
          "properties": {
            "type": {
              "const": "absence"
            },
            "from": {
              "type": "string"
            },
            "to": {
              "type": "string"
            }
          }
        }
      ]
    }
  }
}
