{
  "version": 1,
  "tsConfig": ".arch-tsconfig.json",
  "modules": {
    "core-admin": [
      "packages/core/src/admin/**"
    ],
    "core-agent-reports": [
      "packages/core/src/agent-reports/**"
    ],
    "core-agent-sessions": [
      "packages/core/src/agent-sessions/**"
    ],
    "core-api-contract": [
      "packages/core/src/api-contract/**"
    ],
    "core-assistant": [
      "packages/core/src/assistant/**"
    ],
    "core-auth": [
      "packages/core/src/auth/**"
    ],
    "core-automation": [
      "packages/core/src/automation/**"
    ],
    "core-body": [
      "packages/core/src/body/**"
    ],
    "core-comments": [
      "packages/core/src/comments/**"
    ],
    "core-config": [
      "packages/core/src/lib/env.ts",
      "packages/core/src/lib/rate-limits.ts",
      "packages/core/src/lib/web-base-url.ts"
    ],
    "core-conversations": [
      "packages/core/src/conversations/**"
    ],
    "core-credentials": [
      "packages/core/src/credentials/**"
    ],
    "core-db": [
      "packages/core/src/db/**"
    ],
    "core-development": [
      "packages/core/src/development/**"
    ],
    "core-devices": [
      "packages/core/src/devices/**"
    ],
    "core-ecosystem": [
      "packages/core/src/ecosystem/**"
    ],
    "core-error-intake": [
      "packages/core/src/error-intake/**"
    ],
    "core-feedback": [
      "packages/core/src/feedback/**"
    ],
    "core-forecast": [
      "packages/core/src/forecast/**"
    ],
    "core-guides": [
      "packages/core/src/guides/**"
    ],
    "core-health": [
      "packages/core/src/health/**"
    ],
    "core-install": [
      "packages/core/src/devices/install-routes.ts",
      "packages/core/src/devices/published-build.ts"
    ],
    "core-integration-door": [
      "packages/core/src/integration-door/**"
    ],
    "core-integrations": [
      "packages/core/src/integrations/**"
    ],
    "core-issues": [
      "packages/core/src/issues/**"
    ],
    "core-jobs": [
      "packages/core/src/jobs/**"
    ],
    "core-knowledge": [
      "packages/core/src/knowledge/**"
    ],
    "core-labels": [
      "packages/core/src/labels/**"
    ],
    "core-lib": [
      "packages/core/src/lib/**"
    ],
    "core-lifecycle": [
      "packages/core/src/lifecycle/**"
    ],
    "core-masters": [
      "packages/core/src/masters/**"
    ],
    "core-mcp": [
      "packages/core/src/mcp/**"
    ],
    "core-me": [
      "packages/core/src/me/**"
    ],
    "core-memory": [
      "packages/core/src/memory/**"
    ],
    "core-messaging": [
      "packages/core/src/messaging/**"
    ],
    "core-metrics": [
      "packages/core/src/metrics/**"
    ],
    "core-middleware": [
      "packages/core/src/middleware/**"
    ],
    "core-mockups": [
      "packages/core/src/mockups/**"
    ],
    "core-notifications": [
      "packages/core/src/notifications/**"
    ],
    "core-onboarding": [
      "packages/core/src/onboarding/**"
    ],
    "core-orgs": [
      "packages/core/src/orgs/**"
    ],
    "core-outbox": [
      "packages/core/src/outbox/**"
    ],
    "core-permissions": [
      "packages/core/src/permissions/**"
    ],
    "core-pipeline": [
      "packages/core/src/pipeline/**"
    ],
    "core-preferences": [
      "packages/core/src/preferences/**"
    ],
    "core-project-config": [
      "packages/core/src/project-config/**"
    ],
    "core-product-door": [
      "packages/core/src/product-door/**"
    ],
    "core-project-status": [
      "packages/core/src/project-status/**"
    ],
    "core-projects": [
      "packages/core/src/projects/**"
    ],
    "core-prompt": [
      "packages/core/src/prompt/**"
    ],
    "core-questionnaires": [
      "packages/core/src/questionnaires/**"
    ],
    "core-questions": [
      "packages/core/src/questions/**"
    ],
    "core-queue": [
      "packages/core/src/queue/**"
    ],
    "core-release-batch": [
      "packages/core/src/release-batch/**"
    ],
    "core-requirements": [
      "packages/core/src/requirements/**"
    ],
    "core-runners": [
      "packages/core/src/runners/**"
    ],
    "core-runs": [
      "packages/core/src/runs/**"
    ],
    "core-schedules": [
      "packages/core/src/schedules/**"
    ],
    "core-skills": [
      "packages/core/src/skills/**"
    ],
    "core-suggestions": [
      "packages/core/src/suggestions/**"
    ],
    "core-uploads": [
      "packages/core/src/uploads/**"
    ],
    "core-web-host": [
      "packages/core/src/web-host/**"
    ],
    "core-workflows": [
      "packages/core/src/workflows/**"
    ],
    "core-ws": [
      "packages/core/src/ws/**"
    ],
    "web-app": [
      "packages/web-v2/src/routes/**",
      "packages/web-v2/src/main.tsx"
    ],
    "web-design": [
      "packages/web-v2/src/design/**"
    ],
    "web-features": [
      "packages/web-v2/src/features/**"
    ],
    "web-feature-agent-accounts": [
      "packages/web-v2/src/features/agent-accounts/**"
    ],
    "web-feature-agents": [
      "packages/web-v2/src/features/agents/**"
    ],
    "web-feature-approvals": [
      "packages/web-v2/src/features/approvals/**"
    ],
    "web-feature-attention": [
      "packages/web-v2/src/features/attention/**"
    ],
    "web-feature-auth": [
      "packages/web-v2/src/features/auth/**"
    ],
    "web-feature-mcp-auth": [
      "packages/web-v2/src/features/mcp-auth/**"
    ],
    "web-feature-automation": [
      "packages/web-v2/src/features/automation/**"
    ],
    "web-feature-board": [
      "packages/web-v2/src/features/board/**"
    ],
    "web-feature-chat": [
      "packages/web-v2/src/features/chat/**"
    ],
    "web-feature-chat-dock": [
      "packages/web-v2/src/features/chat-dock/**"
    ],
    "web-feature-comments": [
      "packages/web-v2/src/features/comments/**"
    ],
    "web-feature-contracts": [
      "packages/web-v2/src/features/contracts/**"
    ],
    "web-feature-conversations": [
      "packages/web-v2/src/features/conversations/**"
    ],
    "web-feature-development": [
      "packages/web-v2/src/features/development/**"
    ],
    "web-feature-docs": [
      "packages/web-v2/src/features/docs/**"
    ],
    "web-feature-ecosystem": [
      "packages/web-v2/src/features/ecosystem/**"
    ],
    "web-feature-feedback": [
      "packages/web-v2/src/features/feedback/**"
    ],
    "web-feature-forecast": [
      "packages/web-v2/src/features/forecast/**"
    ],
    "web-feature-guides": [
      "packages/web-v2/src/features/guides/**"
    ],
    "web-feature-integrations": [
      "packages/web-v2/src/features/integrations/**"
    ],
    "web-feature-issue-picker": [
      "packages/web-v2/src/features/issue-picker/**"
    ],
    "web-feature-issues": [
      "packages/web-v2/src/features/issues/**"
    ],
    "web-feature-memory": [
      "packages/web-v2/src/features/memory/**"
    ],
    "web-feature-mockups": [
      "packages/web-v2/src/features/mockups/**"
    ],
    "web-feature-modules": [
      "packages/web-v2/src/features/modules/**"
    ],
    "web-feature-needs-you": [
      "packages/web-v2/src/features/needs-you/**"
    ],
    "web-feature-project-home": [
      "packages/web-v2/src/features/project-home/**"
    ],
    "web-feature-notifications": [
      "packages/web-v2/src/features/notifications/**"
    ],
    "web-feature-onboarding": [
      "packages/web-v2/src/features/onboarding/**"
    ],
    "web-feature-operator": [
      "packages/web-v2/src/features/operator/**"
    ],
    "web-feature-orgs": [
      "packages/web-v2/src/features/orgs/**"
    ],
    "web-feature-overview": [
      "packages/web-v2/src/features/overview/**"
    ],
    "web-feature-pairing": [
      "packages/web-v2/src/features/pairing/**"
    ],
    "web-feature-pipeline": [
      "packages/web-v2/src/features/pipeline/**"
    ],
    "web-feature-preferences": [
      "packages/web-v2/src/features/preferences/**"
    ],
    "web-feature-project-config": [
      "packages/web-v2/src/features/project-config/**"
    ],
    "web-feature-project-dashboard": [
      "packages/web-v2/src/features/project-dashboard/**"
    ],
    "web-feature-project-status": [
      "packages/web-v2/src/features/project-status/**"
    ],
    "web-feature-project-settings": [
      "packages/web-v2/src/features/project-settings/**"
    ],
    "web-feature-projects": [
      "packages/web-v2/src/features/projects/**"
    ],
    "web-feature-question-desk": [
      "packages/web-v2/src/features/question-desk/**"
    ],
    "web-feature-questions": [
      "packages/web-v2/src/features/questions/**"
    ],
    "web-feature-releases": [
      "packages/web-v2/src/features/releases/**"
    ],
    "web-feature-requirements": [
      "packages/web-v2/src/features/requirements/**"
    ],
    "web-feature-run-control": [
      "packages/web-v2/src/features/run-control/**"
    ],
    "web-feature-runners": [
      "packages/web-v2/src/features/runners/**"
    ],
    "web-feature-session": [
      "packages/web-v2/src/features/session/**"
    ],
    "web-feature-sessions": [
      "packages/web-v2/src/features/sessions/**"
    ],
    "web-feature-settings": [
      "packages/web-v2/src/features/settings/**"
    ],
    "web-feature-shell": [
      "packages/web-v2/src/features/shell/**"
    ],
    "web-feature-suggestions": [
      "packages/web-v2/src/features/suggestions/**"
    ],
    "web-feature-tours": [
      "packages/web-v2/src/features/tours/**"
    ],
    "web-feature-version": [
      "packages/web-v2/src/features/version/**"
    ],
    "web-feature-whats-new": [
      "packages/web-v2/src/features/whats-new/**"
    ],
    "web-feature-workflows": [
      "packages/web-v2/src/features/workflows/**"
    ],
    "web-lib": [
      "packages/web-v2/src/lib/**"
    ],
    "web-lib-api": [
      "packages/web-v2/src/lib/api/**"
    ],
    "web-providers": [
      "packages/web-v2/src/providers/**"
    ],
    "web-styles": [
      "packages/web-v2/src/styles/**"
    ]
  },
  "tests": {
    "globs": [